{
  "version": 1,
  "lastUpdated": "2026-09-29T23:50:00Z",
  "source": {
    "name": "Auto Redeem Code Delta Force — Community Feed",
    "minVotes": 3,
    "schemaUrl": "https://raw.githubusercontent.com/kenthudoan/df-codes-data/main/schema.json"
  },
  "codes": [
    {
      "id": "test001",
      "code": "DFTEST2026ABC",
      "title": "Test code từ cộng đồng",
      "description": "Code test để kiểm tra feed",
      "source": "https://github.com/kenthudoan/df-codes-data",
      "tags": ["test"],
      "validFrom": "2026-09-29T00:00:00Z",
      "validUntil": "2026-12-31T23:59:59Z",
      "addedAt": "2026-09-29T23:58:00Z"
    }
  ]
}
